Patient_Id	Post_Title	Post_Body	Filtered_Post_Title	Filtered_Post_Body	Title_Entities	Post_Entities	Condition	Entity	MayoPage	Subforum
0	Sinus infection and pain in collarbone ?	I started having a cough two weeks ago. It started affecting my sinuses about a week ago, so I started taking cold medicine. Instead of getting better, it just got worse. Three days later I would blow my nose and get green-yellow mucous. The next day I woke up and hurt from the crown of my head and down the left side of my head in my ear, jaw, neck, and shoulder. The pain was so bad it even hurt to eat. This is by far the worse sinus infection I have ever had! So, I went to the doctor. He prescribed an antibiotic and an antihistimine (my blood pressure was slightly up, which could have been because of the cold medicine, but it caused him to not want to give me a decongestant). i'm still hurting in my head, ear, and jaw, but not as bad. Mucous is still very colored. But, yesterday, I started hurting in my right shoulder--more like on the tip of the collarbone near my neck. It has some sharp pains, and sometimes dull and achy. I haven't done anything physically that would have caused this type of pain. It doesn't go into the shoulder itself, it just feels like it is in that collarbone. It does hurt also when I move it some and when I cough. Is there any way that this pain could be connected to a sinus infection or even to antibiotics? I'm just wondering because I really have no other explanation to the pain--if this is even an explanation.	sinus infection pain collarbone	i start cough two week ago it start affect sinus week ago i start take cold medicine instead get better get worse three day later i would blow nose get green-yellow mucous the next day i woke hurt crown head left side head ear jaw neck shoulder the pain bad even hurt eat this far worse sinus infection i ever so i go doctor he prescribed antibiotic antihistimine blood pressure slightly could cold medicine cause want give decongestant 'm still hurt head ear jaw bad mucous still color but yesterday i start hurt right shoulder -- like tip collarbone near neck it sharp pain sometimes dull achy i n't do anything physically would cause type pain it n't go shoulder feel like collarbone it hurt also i move i cough is way pain could connect sinus infection even antibiotic i 'm wonder i really explanation pain -- even explanation	Sinus infection_C0037199_sinus infection-pain_C0030193_pain-collarbone_C0008913_collarbone	cough_C0010200_cough-sinuses_C0030471_sinuses-nose_C0028429_nose-mucous_C0026727_mucous-crown_C0010384_crown-head_C0018670_head-head_C0018670_head-ear_C0013443_ear-jaw_C0022359_jaw-neck_C0027530_neck-shoulder_C0037004_shoulder-pain_C0030193_pain-sinus infection_C0037199_sinus infection-blood pressure_C0005823_blood pressure-decongestant_C1306788_decongestant-head_C0018670_head-ear_C0013443_ear-jaw_C0022359_jaw-right shoulder_C0524468_right shoulder-collarbone_C0008913_collarbone-neck_C0027530_neck-sharp pains_C0455270_sharp pains-pain_C0030193_pain-shoulder_C0037004_shoulder-collarbone_C0008913_collarbone-pain_C0030193_pain-sinus infection_C0037199_sinus infection-antibiotics_C0003232_antibiotics-pain_C0030193_pain	Sinusitis	C0037199	DefinitionDefinition\nChronic sinusitis is a common condition in which the [[C1510420|cavities]] around [[C0027423|nasal passages]] ([[C0030471|sinuses]]) become inflamed and swollen. [[C0149516|Chronic sinusitis]] lasts 12 weeks or longer despite treatment attempts.\nAlso known as [[C0149516|chronic rhinosinusitis]], this condition interferes with [[C0012621|drainage]] and causes [[C0026727|mucus]] to build up. If you have [[C0149516|chronic sinusitis]], it may be difficult to breathe through your [[C0028429|nose]]. The area around your eyes and [[C0015450|face]] may feel swollen, and you may have throbbing [[C0015468|facial pain]] or a [[C0018681|headache]].\n[[C0149516|Chronic sinusitis]] may be caused by an infection, but it can also be caused by growths in the [[C0030471|sinuses]] ([[C0027430|nasal polyps]]) or by a [[C0549397|deviated nasal septum]]. [[C0149516|Chronic sinusitis]] most commonly affects young and middle-aged [[C0001675|adults]], but it also can affect [[C0008059|children]].SymptomsSymptoms\nChronic sinusitis and [[C0149512|acute sinusitis]] have similar signs and symptoms, but [[C0149512|acute sinusitis]] is a temporary infection of the [[C0030471|sinuses]] often associated with a cold. At least two of the following signs and symptoms must be present for a diagnosis of [[C0149516|chronic sinusitis]]:\n[[C0012621|Drainage]] of a thick, yellow or greenish discharge from the [[C0028429|nose]] or down the [[C0004600|back]] of the throat\nNasal obstruction or [[C0700148|congestion]], causing difficulty [[C0004048|breathing]] through your [[C0240564|nose Pain]], [[C0684239|tenderness]] and [[C0038999|swelling]] around your eyes, [[C0007966|cheeks]], [[C0028429|nose]] or forehead\nReduced sense of [[C0037361|smell]] and taste\nOther signs and symptoms can include:\nEar pain\nAching in your [[C0460025|upper jaw]] and teeth\nCough, which may be worse at night\nSore throat\nBad breath (halitosis)\nFatigue or irritability\nNausea\nThe signs and symptoms of [[C0149516|chronic sinusitis]] are similar to [[C0149512|acute sinusitis]], except they last longer and often cause more significant [[C0015672|fatigue]]. [[C0015967|Fever]] is n't a common sign of [[C0149516|chronic sinusitis]], as it may be with [[C0149512|acute sinusitis]].\nWhen to see a doctor You may have several episodes of [[C0149512|acute sinusitis]], lasting less than four weeks, before developing [[C0149516|chronic sinusitis]]. You may be referred to an allergist or an ear, [[C0028429|nose]] and throat specialist for [[C0557980|evaluation treatment]].\nSchedule an appointment with your doctor if:\nYou 've had sinusitis a number of times and the condition fails to respond to treatment\nYou have sinusitis symptoms that last more than seven days\nYour symptoms do n't get better after you see your doctor\nSee a doctor immediately if you have symptoms that may be a sign of a serious infection:\n[[C0030193|Pain]] or [[C0038999|swelling]] around your [[C0015392|eyes]]\nA swollen forehead\nSevere headache\nConfusion\nDouble vision or other vision changes\nStiff neck\nShortness of breath	-Conditions and Diseases\n-Sinusitis
1	Sinus Infection, But a Dry Nose??	I just started suffering with sinus problems the last 2 years. I have had 2 sinus surgeries in the past 12 months. (as well as an infection, I had a large cyst in my left maxillary sinus cavity. It was removed and then grew back.) i'm still having problems. I had a ct scan 3 weeks ago and it showed infection in the entire right maxillary sinus and the left maxillary sinus was about 3/4 full of infection. I also have infection in the frontal sinuses, but not as bad. I have severe sinus pain along the cheeks, nose, and between the eyes. This often turns into a migraine. What's strange is that my nose has been dry the past month and I do not have any drainage coming out. I do feel drainage down my throat and it is sore. I have severe inflammation and when I wake up in the mornings, my face is swollen. Also, for about the past 2 months, my checks will turn bright red, swell up, and be severely hot to the touch. This comes and goes. The past week my gums on the left, top side are really sore and painful. I've been on antibiotics but they do not work. Does anyone out there have any suggestions on what to do? Or what this could be caused from? I worry about the infection spreading.	sinus infection but dry nose	i start suffer sinus problem last 2 year i 2 sinus surgery past 12 month well infection i large cyst left maxillary sinus cavity it remove grow back 'm still problem i ct scan 3 week ago show infection entire right maxillary sinus left maxillary sinus 3/4 full infection i also infection frontal sinus bad i severe sinus pain along cheek nose eye this often turn migraine what 's strange nose dry past month i drainage come i feel drainage throat sore i severe inflammation i wake morning face swollen also past 2 month check turn bright red swell severely hot touch this come go the past week gum left top side really sore painful i 've antibiotic work doe anyone suggestion or could cause i worry infection spread	Sinus Infection_C0037199_sinus infection-But_C0233535_but-Dry Nose_C0231919_dry nose	sinus problems_C0577887_sinus problems-sinus surgeries_C0748725_sinus surgeries-cyst_C0010709_cyst-left maxillary sinus_C0225453_left maxillary sinus-cavity_C0011334_cavity-entire right maxillary sinus_C1289023_entire right maxillary sinus-left maxillary sinus_C0225453_left maxillary sinus-frontal sinuses_C0016734_frontal sinuses-sinus pain_C0522251_sinus pain-cheeks_C0007966_cheeks-nose_C0028429_nose-eyes_C0015392_eyes-migraine_C0149931_migraine-nose_C0028429_nose-drainage_C0012621_drainage-drainage_C0012621_drainage-throat_C0031354_throat-severe inflammation_C0522569_severe inflammation-face_C0015450_face-touch_C0702221_touch-past week_C2987125_past week-gums_C0017562_gums-antibiotics_C0003232_antibiotics	Sinusitis	C0037199	DefinitionDefinition\nChronic sinusitis is a common condition in which the [[C1510420|cavities]] around [[C0027423|nasal passages]] ([[C0030471|sinuses]]) become inflamed and swollen. [[C0149516|Chronic sinusitis]] lasts 12 weeks or longer despite treatment attempts.\nAlso known as [[C0149516|chronic rhinosinusitis]], this condition interferes with [[C0012621|drainage]] and causes [[C0026727|mucus]] to build up. If you have [[C0149516|chronic sinusitis]], it may be difficult to breathe through your [[C0028429|nose]]. The area around your eyes and [[C0015450|face]] may feel swollen, and you may have throbbing [[C0015468|facial pain]] or a [[C0018681|headache]].\n[[C0149516|Chronic sinusitis]] may be caused by an infection, but it can also be caused by growths in the [[C0030471|sinuses]] ([[C0027430|nasal polyps]]) or by a [[C0549397|deviated nasal septum]]. [[C0149516|Chronic sinusitis]] most commonly affects young and middle-aged [[C0001675|adults]], but it also can affect [[C0008059|children]].SymptomsSymptoms\nChronic sinusitis and [[C0149512|acute sinusitis]] have similar signs and symptoms, but [[C0149512|acute sinusitis]] is a temporary infection of the [[C0030471|sinuses]] often associated with a cold. At least two of the following signs and symptoms must be present for a diagnosis of [[C0149516|chronic sinusitis]]:\n[[C0012621|Drainage]] of a thick, yellow or greenish discharge from the [[C0028429|nose]] or down the [[C0004600|back]] of the throat\nNasal obstruction or [[C0700148|congestion]], causing difficulty [[C0004048|breathing]] through your [[C0240564|nose Pain]], [[C0684239|tenderness]] and [[C0038999|swelling]] around your eyes, [[C0007966|cheeks]], [[C0028429|nose]] or forehead\nReduced sense of [[C0037361|smell]] and taste\nOther signs and symptoms can include:\nEar pain\nAching in your [[C0460025|upper jaw]] and teeth\nCough, which may be worse at night\nSore throat\nBad breath (halitosis)\nFatigue or irritability\nNausea\nThe signs and symptoms of [[C0149516|chronic sinusitis]] are similar to [[C0149512|acute sinusitis]], except they last longer and often cause more significant [[C0015672|fatigue]]. [[C0015967|Fever]] is n't a common sign of [[C0149516|chronic sinusitis]], as it may be with [[C0149512|acute sinusitis]].\nWhen to see a doctor You may have several episodes of [[C0149512|acute sinusitis]], lasting less than four weeks, before developing [[C0149516|chronic sinusitis]]. You may be referred to an allergist or an ear, [[C0028429|nose]] and throat specialist for [[C0557980|evaluation treatment]].\nSchedule an appointment with your doctor if:\nYou 've had sinusitis a number of times and the condition fails to respond to treatment\nYou have sinusitis symptoms that last more than seven days\nYour symptoms do n't get better after you see your doctor\nSee a doctor immediately if you have symptoms that may be a sign of a serious infection:\n[[C0030193|Pain]] or [[C0038999|swelling]] around your [[C0015392|eyes]]\nA swollen forehead\nSevere headache\nConfusion\nDouble vision or other vision changes\nStiff neck\nShortness of breath	-Conditions and Diseases\n-Sinusitis
2	Constant green phlegm for 2 years	I've had constant green phlegm (at first i thought it looked more like a dark almost browning yellow) for 2 years now. It started right after what my doctor told me was a bronchitis. Since then I cough up green chunks every morning. The green chunks are annoying because they get stuck at the back of my throat and sometimes makes breathing annoying when lying down. While I sleep some chunks get stuck on the top of my tonsils. It doesn't completely stop during the day, it keeps me coughing to clear up my throat. What alarms me the most about it is that my doctor has no idea what it is and has given me all kinds of nasal sprays, medications and antibiotics that didn't improve anything at all. I put this post under sinusitis since I was falsely diagnosed with chronic sinusitis by my doctor for a long time even though the  she made me take were negative. The hospital and an ENT specialist also told me I didn't had chronic sinusitis. The ENT says it is not sinus related. The problem is that my immune system is low since then and that I've been having recurring cases of strep throat or laryngitis. The green phlegm however is not clearing up after the strep throat gets treated or the laryngitis clears up. Other then the phlegm, I don't have any other constant symptoms, though at first I had chest pains in the upper middle of my chest but they weren't very frequent. Since I now consider my family doctor almost incompetent, is there a direction I should point her to? Should I go somewhere else? My next step I asked her for is to see an allergist, even though I have not noticed any allergies and even if I change my routine completely or live somewhere else for a while, nothing changes. Can it be stomach related? Can it be lung related? Can it be mold related?	constant green phlegm 2 year	i 've constant green phlegm first thought look like dark almost browning yellow 2 year it start right doctor told bronchitis since i cough green chunk every morning the green chunk annoy get stuck back throat sometimes make breathing annoy lie while i sleep chunk get stuck top tonsil it n't completely stop day keep cough clear throat what alarm doctor idea give kind nasal spray medication antibiotic n't improve anything i put post sinusitis since i falsely diagnose chronic sinusitis doctor long time even though xray make take negative the hospital ent specialist also told i n't chronic sinusitis the ent say sinus related the problem immune system low since i 've recur case strep throat laryngitis the green phlegm however clearing strep throat get treat laryngitis clear other phlegm i n't constant symptom though first i chest pain upper middle chest n't frequent since i consider family doctor almost incompetent direction i point should i go somewhere else my next step i ask see allergist even though i notice allergy even i change routine completely live somewhere else nothing change can stomach related can lung related can mold related	phlegm_C0225378_phlegm	phlegm_C0225378_phlegm-bronchitis_C0006277_bronchitis-chunks_C0679054_chunks-chunks_C0679054_chunks-throat_C0031354_throat-breathing_C0004048_breathing-lying down_C2584317_lying down-chunks_C0679054_chunks-tonsils_C0836921_tonsils-coughing_C0010200_coughing-throat_C0031354_throat-alarms_C0336648_alarms-antibiotics_C0003232_antibiotics-sinusitis_C0037199_sinusitis-chronic sinusitis_C0149516_chronic sinusitis-_C0043299_x rays-ENT_C0262471_ent-specialist_C0087009_specialist-chronic sinusitis_C0149516_chronic sinusitis-ENT_C0262471_ent-sinus_C0030471_sinus-immune system_C0020962_immune system-strep throat_C0036689_strep throat-laryngitis_C0023067_laryngitis-phlegm_C0225378_phlegm-strep throat_C0036689_strep throat-laryngitis_C0023067_laryngitis-phlegm_C0225378_phlegm-chest pains_C0008031_chest pains-chest_C0817096_chest-family doctor_C1704221_family doctor-allergist_C0334896_allergist-allergies_C0020517_allergies-nothing_C0442735_nothing-stomach_C0038351_stomach-lung_C0024109_lung	Sinusitis	C0037199	DefinitionDefinition\nChronic sinusitis is a common condition in which the [[C1510420|cavities]] around [[C0027423|nasal passages]] ([[C0030471|sinuses]]) become inflamed and swollen. [[C0149516|Chronic sinusitis]] lasts 12 weeks or longer despite treatment attempts.\nAlso known as [[C0149516|chronic rhinosinusitis]], this condition interferes with [[C0012621|drainage]] and causes [[C0026727|mucus]] to build up. If you have [[C0149516|chronic sinusitis]], it may be difficult to breathe through your [[C0028429|nose]]. The area around your eyes and [[C0015450|face]] may feel swollen, and you may have throbbing [[C0015468|facial pain]] or a [[C0018681|headache]].\n[[C0149516|Chronic sinusitis]] may be caused by an infection, but it can also be caused by growths in the [[C0030471|sinuses]] ([[C0027430|nasal polyps]]) or by a [[C0549397|deviated nasal septum]]. [[C0149516|Chronic sinusitis]] most commonly affects young and middle-aged [[C0001675|adults]], but it also can affect [[C0008059|children]].SymptomsSymptoms\nChronic sinusitis and [[C0149512|acute sinusitis]] have similar signs and symptoms, but [[C0149512|acute sinusitis]] is a temporary infection of the [[C0030471|sinuses]] often associated with a cold. At least two of the following signs and symptoms must be present for a diagnosis of [[C0149516|chronic sinusitis]]:\n[[C0012621|Drainage]] of a thick, yellow or greenish discharge from the [[C0028429|nose]] or down the [[C0004600|back]] of the throat\nNasal obstruction or [[C0700148|congestion]], causing difficulty [[C0004048|breathing]] through your [[C0240564|nose Pain]], [[C0684239|tenderness]] and [[C0038999|swelling]] around your eyes, [[C0007966|cheeks]], [[C0028429|nose]] or forehead\nReduced sense of [[C0037361|smell]] and taste\nOther signs and symptoms can include:\nEar pain\nAching in your [[C0460025|upper jaw]] and teeth\nCough, which may be worse at night\nSore throat\nBad breath (halitosis)\nFatigue or irritability\nNausea\nThe signs and symptoms of [[C0149516|chronic sinusitis]] are similar to [[C0149512|acute sinusitis]], except they last longer and often cause more significant [[C0015672|fatigue]]. [[C0015967|Fever]] is n't a common sign of [[C0149516|chronic sinusitis]], as it may be with [[C0149512|acute sinusitis]].\nWhen to see a doctor You may have several episodes of [[C0149512|acute sinusitis]], lasting less than four weeks, before developing [[C0149516|chronic sinusitis]]. You may be referred to an allergist or an ear, [[C0028429|nose]] and throat specialist for [[C0557980|evaluation treatment]].\nSchedule an appointment with your doctor if:\nYou 've had sinusitis a number of times and the condition fails to respond to treatment\nYou have sinusitis symptoms that last more than seven days\nYour symptoms do n't get better after you see your doctor\nSee a doctor immediately if you have symptoms that may be a sign of a serious infection:\n[[C0030193|Pain]] or [[C0038999|swelling]] around your [[C0015392|eyes]]\nA swollen forehead\nSevere headache\nConfusion\nDouble vision or other vision changes\nStiff neck\nShortness of breath	-Conditions and Diseases\n-Sinusitis
3	Sinus Buster nasal spray ? (Page 1)	I've been hearing good things about it but before I buy it I was wondering if anyone else had tried it. I have chonic sinusitis and like most people I've tried a lot of remedies and most dont work like they say. Thanks, Andy	sinus buster nasal spray page 1	i 've hearing good thing i buy i wonder anyone else try i chonic sinusitis like people i 've try lot remedy dont work like say thanks andy	Sinus_C0030471_sinus-nasal spray_C2825048_nasal spray	sinusitis_C0037199_sinusitis-remedies_C0920324_remedies	Sinusitis	C0037199	DefinitionDefinition\nChronic sinusitis is a common condition in which the [[C1510420|cavities]] around [[C0027423|nasal passages]] ([[C0030471|sinuses]]) become inflamed and swollen. [[C0149516|Chronic sinusitis]] lasts 12 weeks or longer despite treatment attempts.\nAlso known as [[C0149516|chronic rhinosinusitis]], this condition interferes with [[C0012621|drainage]] and causes [[C0026727|mucus]] to build up. If you have [[C0149516|chronic sinusitis]], it may be difficult to breathe through your [[C0028429|nose]]. The area around your eyes and [[C0015450|face]] may feel swollen, and you may have throbbing [[C0015468|facial pain]] or a [[C0018681|headache]].\n[[C0149516|Chronic sinusitis]] may be caused by an infection, but it can also be caused by growths in the [[C0030471|sinuses]] ([[C0027430|nasal polyps]]) or by a [[C0549397|deviated nasal septum]]. [[C0149516|Chronic sinusitis]] most commonly affects young and middle-aged [[C0001675|adults]], but it also can affect [[C0008059|children]].SymptomsSymptoms\nChronic sinusitis and [[C0149512|acute sinusitis]] have similar signs and symptoms, but [[C0149512|acute sinusitis]] is a temporary infection of the [[C0030471|sinuses]] often associated with a cold. At least two of the following signs and symptoms must be present for a diagnosis of [[C0149516|chronic sinusitis]]:\n[[C0012621|Drainage]] of a thick, yellow or greenish discharge from the [[C0028429|nose]] or down the [[C0004600|back]] of the throat\nNasal obstruction or [[C0700148|congestion]], causing difficulty [[C0004048|breathing]] through your [[C0240564|nose Pain]], [[C0684239|tenderness]] and [[C0038999|swelling]] around your eyes, [[C0007966|cheeks]], [[C0028429|nose]] or forehead\nReduced sense of [[C0037361|smell]] and taste\nOther signs and symptoms can include:\nEar pain\nAching in your [[C0460025|upper jaw]] and teeth\nCough, which may be worse at night\nSore throat\nBad breath (halitosis)\nFatigue or irritability\nNausea\nThe signs and symptoms of [[C0149516|chronic sinusitis]] are similar to [[C0149512|acute sinusitis]], except they last longer and often cause more significant [[C0015672|fatigue]]. [[C0015967|Fever]] is n't a common sign of [[C0149516|chronic sinusitis]], as it may be with [[C0149512|acute sinusitis]].\nWhen to see a doctor You may have several episodes of [[C0149512|acute sinusitis]], lasting less than four weeks, before developing [[C0149516|chronic sinusitis]]. You may be referred to an allergist or an ear, [[C0028429|nose]] and throat specialist for [[C0557980|evaluation treatment]].\nSchedule an appointment with your doctor if:\nYou 've had sinusitis a number of times and the condition fails to respond to treatment\nYou have sinusitis symptoms that last more than seven days\nYour symptoms do n't get better after you see your doctor\nSee a doctor immediately if you have symptoms that may be a sign of a serious infection:\n[[C0030193|Pain]] or [[C0038999|swelling]] around your [[C0015392|eyes]]\nA swollen forehead\nSevere headache\nConfusion\nDouble vision or other vision changes\nStiff neck\nShortness of breath	-Conditions and Diseases\n-Sinusitis
