Patient_Id	Post_Title	Post_Body	Filtered_Post_Title	Filtered_Post_Body	Title_Entities	Post_Entities	Condition	Entity	MayoPage	Subforum
81	MS confirmed - now everything makes sense!	Hi first of all i wanted to introduce myself. I'm a 27 y/o female and received my MS diagnosis today. I have been reading the forum since I was told that I might have it. Strangely i feel relieved in a sense. Because now all my symptoms make sense. Since I was 14 I have had a few things that I felt was not right. And every time I saw my GP I was told its nothing and I'm attention seeking. From bad , really bad stomach pains ( IBS) to the cramps in my hands and the numbness being my imagination. Then there was the Vertigo (anemia, Although blood work didn't point that way) Restless and painful feet ( stress) Insomnia ( being a student) Fatigue ( being a student) feeling sick after 2 bites of food and yet feeling starving hungry ( being a student) Blurry vision to the point where I could not look people in the eye for the fear they can see my eyes are not focusing ( studying to hard) Stabbing pains all over , especially in my sides in between my ribs ( over exercising) Tightness in my arms, chest (weird just realized I forgot to mention that to the neurologist today) to the point where i cannot breathe. (sinus and working with Toner and chemicals at work) Hart palpitations (too much coffee, like 2 cups a day!!) So beginning of December and after being out of the country for 8 years, my GP decided he wanted to do a full battery of tests to see why i'm getting stomach cramps and why we cannot conceive. On the day I was admitted, my fingers started feeling numb and I had pins and needles in my fingers. Granted , it was happening for at least 3 days before, that day it was really bad. Do the point where my hands where locked into place with extreme and painful spasms that yet again I was told, was a sodium deficiency. They did blood work for,,, O just about everything, Rheumatism , Arthritis etc. I was stabbed so many times i can tell you exactly which vampire doesn't hurt you when they take blood. Once they established that I didn't have the usual stuff, they contemplated MS but pooh-poohed it in the end. I left the hospital with 2 certainties, Yet again I don't have the answers I was looking for and 2 i'm not ovulating and that I have IBS with a side of scars on my stomach lining that accounts for the Heartburn and stomach pains but not for the crawling sensation in my stomach OR the lack of appetite and nausea. Frustrated that I still don't have answers I decided to just let it be and continue with my symptomatic treatment I have been using. A week after I was discharged, the BEST ( WORST - KINDA) thing happened. I woke up with 80 % vision in my left eye. Thinking it was a migraine I bought my usual kits and slept it out for 2 days. 2 days later I had less that 50% vision in my left eye. The rest was just a gray brown blob. Not even when the optometrist shined that really bright light in my eye could I see it! He referred me straight to a Eye specialist who insisted I go for a brain MRI or as my sister called it a MR Brain. I had it the day after my 27 birthday, and when the report came back, it stated that Demyelating plaques are visible consistent with MS. Unfortunately, neither my Ophthalmist nor my GP was in office. I saw my GP about 3 weeks ago and he referred me to a brilliant Neurologist. Thank goodness for medical cover, He booked me in for a LP ( lumbar Punch) within a week, and I'll admit. Even though it hurt like hell and I had back pain and a splitting headache for 3 days after, it was worth it. Today i went to get the results. He told me we are half way with the diagnoses He has no Doubt that it is MS. I wrote him a nice long letter with everything I can remember that could possibly relate to MS. For the most he said that it is to make it easier for me to get around, secondary symptoms. The pain, the appetite etc, its all just secondary. The Optic Neuritis, is a Re-laps. And because it is the only Relapse that he treated, the medical fund would not pay out the medication until they are 100% on the diagnoses. Well, I don't mind waiting for the next re laps or the next MRI either way its only 3 months away, till i can go on meds. Till then i'll be doing my bit by changing my lifestyle and diet. He did say that he would talk to the diagnostic GP who treated me to find out weather the Hands spasming would be reconized as a true re laps. Either way we need to find the time element as we have the symptom . I Understood what he said but its hard to try and explain. It doesn't scare me, its just something that I have to learn to live with. Just like someone with Diabetes learns to live with it, so i have to do the same. One thing that gets on my wick is how people I speak to , Family Etc. try and blame it on my lifestyle, or on bad genes or tell me i'll end up disabled in 2 years and will have no life at all. Ignorant people irritate me and i'm quick to tell then to stop chasing up ghosts. I'm glad there is a place like this where questions can be asked and answers given. I will point more people here if they try and give out wrong MS info. And on a final note, just to prove that i'm glad I know what is wrong ( or right) with me now, I turned to the Neurologist today and said to him. '' you know what, I'm glad its not Lupus, cause its Never Lupus and he laughed!!! Thanks for reading. sorry its long winded but its good to finally get it of my chest. Imps	m confirm everything make sense	hi first want introduce i 'm 27 y/o female receive m diagnosis today i reading forum since i told i might strangely feel relieve sense because symptom make sense since i 14 i thing i felt right and every time i saw gp i told nothing i 'm attention seek from bad really bad stomach pain ibs cramp hand numbness imagination then vertigo anemia although blood work n't point way restless painful foot stress insomnia student fatigue student feel sick 2 bite food yet feel starve hungry student blurry vision point i could look people eye fear see eye focus study hard stab pain especially side rib exercise tightness arm chest weird realize i forgot mention neurologist today point breathe sinus work toner chemical work hart palpitation much coffee like 2 cup day so begin december country 8 year gp decide want full battery test see 'm get stomach cramp conceive on day i admit finger start feel numb i pin needle finger grant happen least 3 day day really bad do point hand lock place extreme painful spasm yet i told sodium deficiency they blood work o everything rheumatism arthritis etc i stabbed many time tell exactly vampire n't hurt take blood once establish i n't usual stuff contemplate m pooh-poohed end i left hospital 2 certainty yet i n't answer i look 2 'm ovulate i ibs side scar stomach line account heartburn stomach pain crawl sensation stomach or lack appetite nausea frustrate i still n't answer i decide let continue symptomatic treatment i use a week i discharge best worst kinda thing happen i woke 80 vision left eye think migraine i bought usual kit slept 2 day 2 day later i le 50 vision left eye the rest gray brown blob not even optometrist shin really bright light eye could i see he refer straight eye specialist insist i go brain mri sister call mr brain i day 27 birthday report come back state demyelating plaque visible consistent m unfortunately neither ophthalmist gp office i saw gp 3 week ago refer brilliant neurologist thank goodness medical cover he book lp lumbar punch within week i 'll admit even though hurt like hell i back pain splitting headache 3 day worth today go get result he told half way diagnosis he doubt m i write nice long letter everything i remember could possibly relate ms. for say make easier get around secondary symptom the pain appetite etc secondary the optic neuritis re-laps and relapse treat medical fund would pay medication 100 diagnosis well i n't mind wait next lap next mri either way 3 month away till go med till 'll bit change lifestyle diet he say would talk diagnostic gp treat find weather hand spasming would reconized true lap either way need find time element symptom i understood say hard try explain it n't scare something i learn live just like someone diabetes learns live one thing get wick people i speak family etc try blame lifestyle bad gene tell 'll end disabled 2 year life ignorant people irritate 'm quick tell stop chase ghost i 'm glad place like question ask answer give i point people try give wrong m info and final note prove 'm glad i know wrong right i turn neurologist today say him. `` know i 'm glad lupus cause never lupus '' laugh thanks reading sorry long wind good finally get chest imp	sense_C0036658_sense	today_C0750526_today-sense_C0036658_sense-sense_C0036658_sense-nothing_C0442735_nothing-attention seeking_C0474408_attention seeking-stomach pains_C1963242_stomach pains-IBS_C0022104_ibs-cramps_C0026821_cramps-hands_C0018563_hands-numbness_C0028643_numbness-imagination_C0020913_imagination-Vertigo_C0042571_vertigo-anemia_C0002871_anemia-Restless_C0085631_restless-painful feet_C0857248_painful feet-Insomnia_C0917801_insomnia-student_C0038492_student-Fatigue_C0015672_fatigue-student_C0038492_student-feeling sick_C0857027_feeling sick-student_C0038492_student-Blurry vision_C0344232_blurry vision-eye_C0015392_eye-fear_C0015726_fear-eyes_C0015392_eyes-Stabbing pains_C0278145_stabbing pains-ribs_C0035561_ribs-arms_C0446516_arms-chest_C0817096_chest-neurologist_C0237426_neurologist-today_C0750526_today-sinus_C0030471_sinus-palpitations_C0030252_palpitations-coffee_C0009237_coffee-battery_C0542351_battery-stomach cramps_C0344375_stomach cramps-fingers_C0016129_fingers-pins and needles_C0423572_pins and needles-fingers_C0016129_fingers-hands_C0018563_hands-spasms_C0037763_spasms-sodium deficiency_C1971019_sodium deficiency-Rheumatism_C0035435_rheumatism-Arthritis_C0003864_arthritis-IBS_C0022104_ibs-scars_C0241158_scars-stomach_C0038351_stomach-Heartburn_C0018834_heartburn-stomach pains_C1963242_stomach pains-crawling sensation_C0016579_crawling sensation-stomach_C0038351_stomach-lack of appetite_C0003123_lack of appetite-nausea_C0027497_nausea-BEST_C0339510_best-vision_C0042789_vision-left eye_C0229090_left eye-Thinking_C0039869_thinking-migraine_C0149931_migraine-vision_C0042789_vision-left eye_C0229090_left eye-optometrist_C0029146_optometrist-light_C0023693_light-eye_C0015392_eye-Eye_C0015392_eye-specialist_C0087009_specialist-brain MRI_C0412675_brain mri-Brain_C0006104_brain-plaques_C0333463_plaques-Neurologist_C0237426_neurologist-cover_C1707529_cover-a LP_C0065058_a lp-Punch_C0182555_punch-back pain_C0004604_back pain-headache_C0018681_headache-Today_C0750526_today-Doubt_C0870444_doubt-letter_C2360551_letter-pain_C0030193_pain-appetite_C0003618_appetite-Optic Neuritis_C0029134_optic neuritis-laps_C3173571_laps-MRI_C0024485_mri-weather_C0043085_weather-Hands_C0018563_hands-laps_C3173571_laps-Diabetes_C0011849_diabetes-bad genes_C1366450_bad genes-ghosts_C0014776_ghosts-note_C1316572_note-Neurologist_C0237426_neurologist-today_C0750526_today-Lupus_C0024141_lupus-Lupus_C0024141_lupus-reading_C0034754_reading-chest_C0817096_chest-Imps_C1328256_imps	Multiple Sclerosis	C0002395	DefinitionDefinition\nMultiple sclerosis (MS) is a potentially debilitating disease in which your body's [[C0020962|immune system]] eats away at the protective [[C0009653|sheath]] that covers your [[C0027740|nerves]]. This interferes with the communication between your [[C0006104|brain]] and the rest of your body. Ultimately, this may result in [[C0868945|deterioration]] of the [[C0027740|nerves]] themselves, a process that 's not reversible.\nSymptoms vary widely, depending on the amount of damage and which [[C0027740|nerves]] are affected. People with severe cases of [[C0026769|multiple sclerosis]] may lose the ability to walk or speak. [[C0026769|Multiple sclerosis]] can be difficult to diagnose early in the course of the disease because symptoms often come and go-- sometimes disappearing for months.\nThere 's no [[C1511495|cure]] for [[C0026769|multiple sclerosis]]. However treatments can help treat attacks, modify the course of the disease and treat symptoms.SymptomsSymptoms\nSigns and symptoms of [[C0026769|multiple sclerosis]] vary widely, depending on the location of affected [[C0027749|nerve fibers]]. Multiple sclerosis signs and symptoms may include:\n[[C0028643|Numbness]] or weakness in one or more limbs, which typically occurs on one side of your body at a time or the bottom half of your body\nPartial or complete loss of [[C0042789|vision]], usually in one [[C0015392|eye]] at a time, often with [[C0030193|pain]] during [[C0015413|eye movement]] ([[C0029134|optic neuritis]])\n[[C0012569|Double vision]] or [[C0344232|blurring]] of vision\nTingling or [[C0030193|pain]] in parts of your body\nElectric-shock sensations that occur with certain head movements\nTremor, [[C0520966|lack of coordination]] or unsteady gait\nFatigue\nDizziness\nMost people with [[C0026769|multiple sclerosis]], particularly in the beginning stages of the disease, experience relapses of symptoms, which are followed by [[C0025344|periods]] of complete or partial remission. Signs and symptoms of [[C0026769|multiple sclerosis]] often are triggered or worsened by an increase in body temperature.	-Conditions and Diseases\n-Multiple Sclerosis
82	MS and second condition involving the brain?	At 23 I went to the dr because I had been lactating for several years. I was also experiencing balance problems, not severe, but didn't mention that. I was sent for an MRI for the lactating as he suspected tumor on pituitary gland. A few days later I was told I had MS. The next day the neurologist sent me for lumbar puncture and I was officially diagnosed with MS. The lactating problem was forgotten by drs. since focus was on MS. it's been 4 years and I have been on copaxone, tysabri, IVIG, rebif, Gilenya, and had stem cell treatment in Costa Rica. Nothing has had any affect. I am now bedridden. I went from balance problems to tremors to the point I cannot use my hands to feed myself or do anything else, I cannot walk at all, I cannot sit up on my own, my vision is almost 100% gone, my speech and thinking ability are impaired, I have no bowel or bladder control. No meds help, no treatment helps and I've not been able to find one case of MS that has progressed this quickly. I am wondering if the initial problem, the lactating, could be a sign of a second problem such as a brain tumor or something else. The Neurologist focuses only on my MS symptoms and wants me to go on chemo for it. I feel that something else could be going on since this has progressed so fast. I also have pain in all my joints. I know I have MS, or the MRI's certainly show lesions but I've had no new lesions in 2 years yet the progression continues. I am desperate. My swallowing has been affected so I am only on Ensure Plus and still have choking incidences. I am so scared.	m second condition involve brain	at 23 i go dr i lactate several year i also experience balance problem severe n't mention i sent mri lactate suspect tumor pituitary gland a day later i told i m the next day neurologist sent lumbar puncture i officially diagnose m the lactate problem forgotten drs since focus ms. 's 4 year i copaxone tysabri ivig rebif gilenya stem cell treatment costa rica nothing affect i bedridden i go balance problem tremor point i use hand feed anything else i walk i sit vision almost 100 go speech think ability impaired i bowel bladder control no med help treatment help i 've able find one case m progress quickly i wonder initial problem lactate could sign second problem brain tumor something else the neurologist focus m symptom want go chemo i feel something else could go since progress fast i also pain joint i know i m mri 's certainly show lesion i 've new lesion 2 year yet progression continue i desperate my swallow affected i ensure plus still choke incidence i scar	the brain_C0006104_the brain	balance problems_C0575090_balance problems-MRI_C0024485_mri-lactating_C2828358_lactating-tumor_C0027651_tumor-pituitary gland_C0032005_pituitary gland-neurologist_C0237426_neurologist-lumbar puncture_C0037943_lumbar puncture-lactating_C2828358_lactating-copaxone_C0528175_copaxone-tysabri_C1529600_tysabri-IVIG_C0085297_ivig-rebif_C0752980_rebif-Gilenya_C2938762_gilenya-stem cell_C0038250_stem cell-Costa Rica_C0010182_costa rica-Nothing_C0442735_nothing-affect_C0001721_affect-balance problems_C0575090_balance problems-tremors_C0040822_tremors-hands_C0018563_hands-vision_C0042789_vision-thinking_C0039869_thinking-bowel_C0021853_bowel-bladder control_C0542565_bladder control-lactating_C2828358_lactating-brain tumor_C0006118_brain tumor-Neurologist_C0237426_neurologist-chemo_C0392920_chemo-joints_C0022417_joints-MRI_C0024485_mri-lesions_C0221198_lesions-lesions_C0221198_lesions-swallowing_C0011167_swallowing-Ensure Plus_C0059375_ensure plus-choking_C0008301_choking	Multiple Sclerosis	C0002395	DefinitionDefinition\nMultiple sclerosis (MS) is a potentially debilitating disease in which your body's [[C0020962|immune system]] eats away at the protective [[C0009653|sheath]] that covers your [[C0027740|nerves]]. This interferes with the communication between your [[C0006104|brain]] and the rest of your body. Ultimately, this may result in [[C0868945|deterioration]] of the [[C0027740|nerves]] themselves, a process that 's not reversible.\nSymptoms vary widely, depending on the amount of damage and which [[C0027740|nerves]] are affected. People with severe cases of [[C0026769|multiple sclerosis]] may lose the ability to walk or speak. [[C0026769|Multiple sclerosis]] can be difficult to diagnose early in the course of the disease because symptoms often come and go-- sometimes disappearing for months.\nThere 's no [[C1511495|cure]] for [[C0026769|multiple sclerosis]]. However treatments can help treat attacks, modify the course of the disease and treat symptoms.SymptomsSymptoms\nSigns and symptoms of [[C0026769|multiple sclerosis]] vary widely, depending on the location of affected [[C0027749|nerve fibers]]. Multiple sclerosis signs and symptoms may include:\n[[C0028643|Numbness]] or weakness in one or more limbs, which typically occurs on one side of your body at a time or the bottom half of your body\nPartial or complete loss of [[C0042789|vision]], usually in one [[C0015392|eye]] at a time, often with [[C0030193|pain]] during [[C0015413|eye movement]] ([[C0029134|optic neuritis]])\n[[C0012569|Double vision]] or [[C0344232|blurring]] of vision\nTingling or [[C0030193|pain]] in parts of your body\nElectric-shock sensations that occur with certain head movements\nTremor, [[C0520966|lack of coordination]] or unsteady gait\nFatigue\nDizziness\nMost people with [[C0026769|multiple sclerosis]], particularly in the beginning stages of the disease, experience relapses of symptoms, which are followed by [[C0025344|periods]] of complete or partial remission. Signs and symptoms of [[C0026769|multiple sclerosis]] often are triggered or worsened by an increase in body temperature.	-Conditions and Diseases\n-Multiple Sclerosis
83	Just got diagnosed with ms...what should i expect?	I am 5 months pregnant and have been told for the last five months that the numbness in my hands was pregnancy carpal tunnel. Finally 2 MRI's showed a lesion on my spine and several lesions in my brain. I have two young children and one on they way and am so scared and feeling guilty that I will not be able to care for them. The numbness in my hands has not subsided after a round of steroids and my whole body has begun tingling when I move a certain way. Is there anything that can be done for my hands now or are they permanently numb? Any information people can give would be great. Thank you.	just get diagnose m ... expect	i 5 month pregnant told last five month numbness hand pregnancy carpal tunnel finally 2 mri 's show lesion spine several lesion brain i two young child one way scar feel guilty i able care the numbness hand subside round steroid whole body begin tingle i move certain way is anything do hand permanently numb any information people give would great thank	None	numbness_C0028643_numbness-hands_C0018563_hands-pregnancy_C0032961_pregnancy-carpal tunnel_C0225091_carpal tunnel-MRI_C0024485_mri-lesion_C0221198_lesion-spine_C0037949_spine-lesions_C0221198_lesions-brain_C0006104_brain-young children_C0728836_young children-feeling guilty_C0018379_feeling guilty-numbness_C0028643_numbness-hands_C0018563_hands-steroids_C0038317_steroids-hands_C0018563_hands	Multiple Sclerosis	C0002395	DefinitionDefinition\nMultiple sclerosis (MS) is a potentially debilitating disease in which your body's [[C0020962|immune system]] eats away at the protective [[C0009653|sheath]] that covers your [[C0027740|nerves]]. This interferes with the communication between your [[C0006104|brain]] and the rest of your body. Ultimately, this may result in [[C0868945|deterioration]] of the [[C0027740|nerves]] themselves, a process that 's not reversible.\nSymptoms vary widely, depending on the amount of damage and which [[C0027740|nerves]] are affected. People with severe cases of [[C0026769|multiple sclerosis]] may lose the ability to walk or speak. [[C0026769|Multiple sclerosis]] can be difficult to diagnose early in the course of the disease because symptoms often come and go-- sometimes disappearing for months.\nThere 's no [[C1511495|cure]] for [[C0026769|multiple sclerosis]]. However treatments can help treat attacks, modify the course of the disease and treat symptoms.SymptomsSymptoms\nSigns and symptoms of [[C0026769|multiple sclerosis]] vary widely, depending on the location of affected [[C0027749|nerve fibers]]. Multiple sclerosis signs and symptoms may include:\n[[C0028643|Numbness]] or weakness in one or more limbs, which typically occurs on one side of your body at a time or the bottom half of your body\nPartial or complete loss of [[C0042789|vision]], usually in one [[C0015392|eye]] at a time, often with [[C0030193|pain]] during [[C0015413|eye movement]] ([[C0029134|optic neuritis]])\n[[C0012569|Double vision]] or [[C0344232|blurring]] of vision\nTingling or [[C0030193|pain]] in parts of your body\nElectric-shock sensations that occur with certain head movements\nTremor, [[C0520966|lack of coordination]] or unsteady gait\nFatigue\nDizziness\nMost people with [[C0026769|multiple sclerosis]], particularly in the beginning stages of the disease, experience relapses of symptoms, which are followed by [[C0025344|periods]] of complete or partial remission. Signs and symptoms of [[C0026769|multiple sclerosis]] often are triggered or worsened by an increase in body temperature.	-Conditions and Diseases\n-Multiple Sclerosis
